{
  "$schema": "https://json-schema.org/draft/2020-12/schema",
  "$id": "https://bench.drizzle.rs/schema/target.v1.schema.json",
  "title": "Target v1",
  "type": "object",
  "additionalProperties": false,
  "required": [
    "version",
    "id",
    "display",
    "lang",
    "runtime",
    "orm",
    "driver",
    "proc",
    "pool",
    "db",
    "wire",
    "fair",
    "contract",
    "parity",
    "load"
  ],
  "properties": {
    "version": {
      "const": "v1"
    },
    "id": {
      "type": "string",
      "pattern": "^[a-z0-9][a-z0-9-]*$"
    },
    "display": {
      "type": "object",
      "additionalProperties": false,
      "required": [
        "name"
      ],
      "properties": {
        "name": {
          "type": "string",
          "minLength": 1
        },
        "description": {
          "type": "string",
          "minLength": 1
        }
      }
    },
    "lang": {
      "type": "string",
      "enum": [
        "ts",
        "go",
        "rust",
        "other"
      ]
    },
    "runtime": {
      "type": "object",
      "additionalProperties": false,
      "required": [
        "name",
        "ver"
      ],
      "properties": {
        "name": {
          "type": "string",
          "minLength": 1
        },
        "ver": {
          "type": "string",
          "minLength": 1
        }
      }
    },
    "orm": {
      "type": "object",
      "additionalProperties": false,
      "required": [
        "name",
        "ver"
      ],
      "properties": {
        "name": {
          "type": "string",
          "minLength": 1
        },
        "ver": {
          "type": "string",
          "minLength": 1
        }
      }
    },
    "driver": {
      "type": "object",
      "additionalProperties": false,
      "required": [
        "name",
        "ver"
      ],
      "properties": {
        "name": {
          "type": "string",
          "minLength": 1
        },
        "ver": {
          "type": "string",
          "minLength": 1
        },
        "transport": {
          "type": "string"
        }
      }
    },
    "proc": {
      "type": "object",
      "additionalProperties": false,
      "required": [
        "mode",
        "workers"
      ],
      "properties": {
        "mode": {
          "type": "string",
          "enum": [
            "single",
            "multi"
          ]
        },
        "workers": {
          "type": "integer",
          "minimum": 1
        }
      }
    },
    "pool": {
      "type": "object",
      "additionalProperties": false,
      "required": [
        "max"
      ],
      "properties": {
        "max": {
          "type": "integer",
          "minimum": 1
        },
        "min": {
          "type": "integer",
          "minimum": 0
        },
        "acquire_ms": {
          "type": "integer",
          "minimum": 1
        }
      }
    },
    "db": {
      "type": "object",
      "additionalProperties": false,
      "required": [
        "profile",
        "hash"
      ],
      "properties": {
        "profile": {
          "type": "string",
          "minLength": 1
        },
        "hash": {
          "type": "string",
          "pattern": "^sha256:[a-f0-9]{64}$"
        },
        "prepared": {
          "type": "boolean",
          "description": "Whether the target reuses server-side prepared statements across requests. Optional and additive in v1; absent means unknown."
        }
      }
    },
    "wire": {
      "type": "object",
      "additionalProperties": false,
      "required": [
        "format"
      ],
      "properties": {
        "format": {
          "type": "string",
          "enum": [
            "json",
            "text",
            "binary",
            "bsatn"
          ]
        }
      }
    },
    "fair": {
      "type": "object",
      "additionalProperties": false,
      "description": "Declared harness. Targets sharing a `family` must declare identical `workers`, `pool` and `tuning`, or the run fails: a ranked library-vs-library table is only meaningful when every entry ran the same harness. Across families the values are free to differ — that difference is the stack comparison — and the manifest records them per family.",
      "required": [
        "family",
        "workers",
        "pool",
        "db",
        "schema",
        "contract",
        "tuning"
      ],
      "properties": {
        "family": {
          "type": "string",
          "description": "Comparison group: the set of targets claiming to be directly comparable, within which the harness is enforced identical and within-group deltas are scoped. Usually one per database engine, but it splits when the harness genuinely cannot be equalised — `sqlite-ts` is separate from `sqlite`, and `postgres-ts` from `postgres`, because those runtimes are synchronous or single-threaded and matching the Rust pool there would be theatre rather than fairness. Conversely `postgres` deliberately spans two spec files: the builtin drizzle-rs/tokio-postgres targets and the sqlx/diesel/sea-orm/toasty file are all Rust on the same harness, and that is the most valuable library comparison in the suite. Grouping is declared per target precisely so it is not inferred from file layout, and `db.profile` (prepared vs unprepared) and `fair.db` (SQL dialect) identify neither. THIS ENUM IS ONE KEY SPACE with `harness[].family` and `target_meta[].fair.family` in run-manifest.v1; all three must be extended together, along with the dashboard's family vocabulary. Artifacts carry these ids only — display labels belong to the presentation layer, since a name frozen into a published artifact can never be reworded.",
          "$ref": "#/$defs/family"
        },
        "workers": {
          "type": "integer",
          "minimum": 1
        },
        "pool": {
          "type": "integer",
          "minimum": 1
        },
        "db": {
          "type": "string",
          "minLength": 1
        },
        "schema": {
          "type": "string",
          "pattern": "^sha256:[a-f0-9]{64}$"
        },
        "contract": {
          "type": "string",
          "minLength": 1
        },
        "tuning": {
          "type": "string",
          "minLength": 1,
          "description": "One-line summary of the engine tuning this target runs under (pragmas, server image, cache settings). Compared for equality within a family, and displayed per family so a reader cannot mistake a tuning difference for a library one."
        }
      }
    },
    "contract": {
      "type": "object",
      "additionalProperties": false,
      "required": [
        "ver"
      ],
      "properties": {
        "ver": {
          "type": "string",
          "minLength": 1
        }
      }
    },
    "parity": {
      "$ref": "#/$defs/exec"
    },
    "warmup": {
      "$ref": "#/$defs/exec"
    },
    "load": {
      "$ref": "#/$defs/exec"
    },
    "server": {
      "$ref": "#/$defs/exec"
    },
    "group": {
      "type": "string",
      "minLength": 1
    },
    "data_access": {
      "type": "string",
      "enum": [
        "sql-roundtrip",
        "in-process-cache",
        "in-database"
      ],
      "default": "sql-roundtrip",
      "description": "How the target reaches its data. 'in-process-cache' targets answer from a materialized in-process replica and are not directly comparable with SQL round-trip targets. 'in-database' targets run each route's query logic inside the database (for example SpacetimeDB module procedures) and only forward requests; they do real per-request database work and are held to the family's harness like SQL round-trip targets. Optional and additive in v1."
    },
    "sql_variant": {
      "type": "string",
      "minLength": 1,
      "description": "Free-form note describing how this target's query shape deviates from the canonical query catalog. Optional and additive in v1."
    }
  },
  "$defs": {
    "family": {
      "type": "string",
      "description": "Comparison-group vocabulary. Kept byte-identical to `harness[].family` and `target_meta[].fair.family` in run-manifest.v1 — the runner has a test that fails if the three drift, because a mismatch would silently render every affected row as \"harness not declared\".",
      "enum": [
        "sqlite",
        "sqlite-ts",
        "libsql",
        "turso",
        "postgres",
        "postgres-ts",
        "spacetimedb"
      ]
    },
    "exec": {
      "type": "object",
      "additionalProperties": false,
      "required": [
        "cmd"
      ],
      "properties": {
        "cmd": {
          "type": "array",
          "minItems": 1,
          "items": {
            "type": "string",
            "minLength": 1
          }
        },
        "cwd": {
          "type": "string",
          "minLength": 1
        },
        "env": {
          "type": "object",
          "additionalProperties": {
            "type": "string"
          }
        },
        "timeout_s": {
          "type": "integer",
          "minimum": 1
        }
      }
    }
  }
}
