[
  {
    "version": "v1",
    "id": "spacetime-pgwire-rs",
    "display": {
      "name": "SpacetimeDB PGWire",
      "description": "SpacetimeDB PGWire target using a tokio-postgres simple-query client pool. PGWire supports a narrower SQL surface, so unsupported query shapes are implemented in the target process while preserving the same HTTP contract."
    },
    "group": "spacetimedb",
    "lang": "rust",
    "runtime": {
      "name": "rust",
      "ver": "1.98.1"
    },
    "orm": {
      "name": "none",
      "ver": "0"
    },
    "driver": {
      "name": "tokio-postgres-simple",
      "ver": "0.7.18"
    },
    "proc": {
      "mode": "single",
      "workers": 1
    },
    "pool": {
      "max": 4,
      "min": 1,
      "acquire_ms": 50
    },
    "db": {
      "profile": "spacetimedb-pgwire",
      "hash": "sha256:7bd4286ec47f86445e5ef9f6cc6357a27974cb8313766444fa5cbeff8eb83d43",
      "prepared": false
    },
    "wire": {
      "format": "text"
    },
    "fair": {
      "family": "spacetimedb",
      "workers": 1,
      "pool": 4,
      "db": "spacetimedb",
      "schema": "sha256:67d569fc52dca6de6f2747867f2e7abe8f4cc736f2c2454f9da5f6e78901759d",
      "contract": "v1",
      "tuning": "stock spacetimedb standalone, default module storage"
    },
    "contract": {
      "ver": "v1"
    },
    "server": {
      "cmd": ["$BENCH_RUNNER_BIN", "serve"]
    },
    "parity": {
      "cmd": ["$BENCH_RUNNER_BIN", "parity"]
    },
    "load": {
      "cmd": ["$BENCH_RUNNER_BIN", "load"]
    },
    "sql_variant": "id-range pagination, in-process aggregation"
  },
  {
    "version": "v1",
    "id": "spacetime-sdk-rs",
    "display": {
      "name": "SpacetimeDB SDK",
      "description": "SpacetimeDB native Rust SDK target. Seeds through the module reducer, subscribes to the benchmark tables over WebSocket, validates full table counts, and serves the HTTP contract from the materialized subscription cache."
    },
    "group": "spacetimedb",
    "lang": "rust",
    "runtime": {
      "name": "rust",
      "ver": "1.98.1"
    },
    "orm": {
      "name": "none",
      "ver": "0"
    },
    "driver": {
      "name": "spacetimedb-sdk",
      "ver": "2.7.1",
      "transport": "websocket"
    },
    "proc": {
      "mode": "single",
      "workers": 1
    },
    "pool": {
      "max": 1,
      "min": 1,
      "acquire_ms": 1
    },
    "db": {
      "profile": "spacetimedb-sdk",
      "hash": "sha256:7bd4286ec47f86445e5ef9f6cc6357a27974cb8313766444fa5cbeff8eb83d43",
      "prepared": false
    },
    "wire": {
      "format": "bsatn"
    },
    "fair": {
      "family": "spacetimedb",
      "workers": 1,
      "pool": 1,
      "db": "spacetimedb",
      "schema": "sha256:67d569fc52dca6de6f2747867f2e7abe8f4cc736f2c2454f9da5f6e78901759d",
      "contract": "v1",
      "tuning": "stock spacetimedb standalone, default module storage"
    },
    "contract": {
      "ver": "v1"
    },
    "server": {
      "cmd": ["cargo", "run", "-q", "--release", "--manifest-path", "bench/targets/spacetime-native-rs/Cargo.toml"]
    },
    "parity": {
      "cmd": ["$BENCH_RUNNER_BIN", "parity"]
    },
    "load": {
      "cmd": ["$BENCH_RUNNER_BIN", "load"]
    },
    "data_access": "in-process-cache",
    "sql_variant": "no SQL; answers from the materialized subscription cache"
  },
  {
    "version": "v1",
    "id": "spacetime-module-rs",
    "display": {
      "name": "SpacetimeDB module",
      "description": "SpacetimeDB on its own terms: application logic lives inside the database. Every route's lookups, joins, aggregates and JSON serialization run in the Northwind module as one procedure; the HTTP process is a thin forwarder that turns each request into a single POST /v1/database/<db>/call/<procedure> and returns the procedure's body unchanged. In-flight calls are capped at the pool size, like the PGWire client pool."
    },
    "group": "spacetimedb",
    "lang": "rust",
    "runtime": {
      "name": "rust",
      "ver": "1.98.1"
    },
    "orm": {
      "name": "none",
      "ver": "0"
    },
    "driver": {
      "name": "spacetimedb-procedure-http",
      "ver": "2.8.0",
      "transport": "http"
    },
    "proc": {
      "mode": "single",
      "workers": 1
    },
    "pool": {
      "max": 4,
      "min": 1
    },
    "db": {
      "profile": "spacetimedb-module",
      "hash": "sha256:7bd4286ec47f86445e5ef9f6cc6357a27974cb8313766444fa5cbeff8eb83d43",
      "prepared": false
    },
    "wire": {
      "format": "json"
    },
    "fair": {
      "family": "spacetimedb",
      "workers": 1,
      "pool": 4,
      "db": "spacetimedb",
      "schema": "sha256:67d569fc52dca6de6f2747867f2e7abe8f4cc736f2c2454f9da5f6e78901759d",
      "contract": "v1",
      "tuning": "stock spacetimedb standalone, default module storage"
    },
    "contract": {
      "ver": "v1"
    },
    "server": {
      "cmd": ["cargo", "run", "-q", "--release", "--manifest-path", "bench/targets/spacetime-native-rs/Cargo.toml", "--", "--module-procedures"]
    },
    "parity": {
      "cmd": ["$BENCH_RUNNER_BIN", "parity"]
    },
    "load": {
      "cmd": ["$BENCH_RUNNER_BIN", "load"]
    },
    "data_access": "in-database",
    "sql_variant": "no client SQL; each route is one module procedure that runs the query logic and serializes the response inside the database"
  }
]
